{
  "TYPES": {
    "ember": {"name":"Ember","color":"#ff7a3d","acc":"#ffd23f","tier":1,"base":{"hp":140,"atk":16,"spd":170},"elem":"burn","support":"+10% weapon damage","weight":30},
    "fungal": {"name":"Fungal","color":"#e0527a","acc":"#b8f06a","tier":1,"base":{"hp":180,"atk":12,"spd":150},"elem":"spore","support":"+2 food when you extract","weight":30},
    "tide": {"name":"Tide","color":"#3fa9ff","acc":"#c8f4ff","tier":2,"base":{"hp":160,"atk":11,"spd":160},"elem":"soak","support":"You regenerate 1 HP per second","weight":16},
    "echo": {"name":"Echo","color":"#9b7bff","acc":"#e8c8ff","tier":2,"base":{"hp":130,"atk":13,"spd":190},"elem":"static","support":"Reveals the floor map and hollow walls","weight":14},
    "gale": {"name":"Gale","color":"#4fe0c8","acc":"#fff6a8","tier":3,"base":{"hp":135,"atk":17,"spd":220},"elem":"gust","support":"Unlocks cliff extracts, +10% move speed","weight":5},
    "crystal": {"name":"Crystal","color":"#ff8fe0","acc":"#ffffff","tier":3,"base":{"hp":150,"atk":12,"spd":150},"elem":"brittle","support":"20% chance to block a hit","weight":3.5},
    "warden": {"name":"Warden","color":"#e3b04b","acc":"#ffcf4a","tier":4,"base":{"hp":260,"atk":12,"spd":135},"elem":"stagger","support":"+15% max HP for you","weight":1.5},
    "venom": {"name":"Venom","color":"#9be35a","acc":"#e6ff6a","tier":3,"base":{"hp":150,"atk":15,"spd":160},"elem":"poison","support":"Your bullets sometimes poison","weight":0},
    "lumen": {"name":"Lumen","color":"#fff3a8","acc":"#ffffff","tier":4,"base":{"hp":170,"atk":15,"spd":155},"elem":"glare","support":"Lights the dark and the Underheart's hidden walls","weight":0}
  },
  "TIER": [
    "",
    "Common",
    "Uncommon",
    "Rare",
    "Very rare"
  ],
  "SPECIES": {
    "cindlet": {"name":"Cindlet","type":"ember","col":"#ff9a4d","shade":"#c2561d","size":0.85,"mods":{"hp":0.85,"atk":0.95,"spd":1.15,"rate":1.1},"w":6,"blurb":"A hopping spark with a flame tuft."},
    "pyrrox": {"name":"Pyrrox","type":"ember","col":"#ff6a3d","shade":"#b33a1d","size":1,"mods":{"hp":1,"atk":1.15,"spd":1,"rate":1},"w":3,"blurb":"A fox with a burning tail."},
    "magmaul": {"name":"Magmaul","type":"ember","col":"#b8452b","shade":"#5a1a10","size":1.15,"mods":{"hp":1.3,"atk":1.1,"spd":0.85,"rate":0.85},"w":1,"blurb":"A lava bear, slow and molten."},
    "puffcap": {"name":"Puffcap","type":"fungal","col":"#e0527a","shade":"#9c2c4f","size":0.9,"mods":{"hp":1.15,"atk":0.9,"spd":0.95,"rate":1},"w":6,"blurb":"A sturdy little mushroom."},
    "shroomite": {"name":"Shroomite","type":"fungal","col":"#c04ad8","shade":"#5a1a6b","size":1,"mods":{"hp":1,"atk":1.15,"spd":1,"rate":1},"w":3,"blurb":"A horned beetle with a toadstool shell."},
    "mycelisk": {"name":"Mycelisk","type":"fungal","col":"#ff8a5c","shade":"#a8452a","size":1.1,"mods":{"hp":1.1,"atk":1,"spd":0.9,"rate":1.25},"w":1,"blurb":"A serpent of living mycelium."},
    "dewdrip": {"name":"Dewdrip","type":"tide","col":"#5cc8ff","shade":"#2a7ab3","size":0.85,"mods":{"hp":0.9,"atk":0.95,"spd":1.15,"rate":1.1},"w":6,"blurb":"A bouncy water droplet."},
    "coralisk": {"name":"Coralisk","type":"tide","col":"#ff7a6a","shade":"#a83a2a","size":1,"mods":{"hp":1.25,"atk":0.95,"spd":0.9,"rate":1},"w":3,"blurb":"A crab wearing a coral crown."},
    "tidewyrm": {"name":"Tidewyrm","type":"tide","col":"#2f6bff","shade":"#1a3a9a","size":1.1,"mods":{"hp":1.1,"atk":1.2,"spd":1,"rate":1},"w":1,"blurb":"A deep-water eel."},
    "chirrup": {"name":"Chirrup","type":"echo","col":"#b39bff","shade":"#6f55c2","size":0.85,"mods":{"hp":0.9,"atk":0.95,"spd":1.2,"rate":1.05},"w":6,"blurb":"A chattering cave flier."},
    "vesperbat": {"name":"Vesperbat","type":"echo","col":"#7b5bff","shade":"#3a2290","size":1,"mods":{"hp":1,"atk":1,"spd":1,"rate":1.25},"w":3,"blurb":"A big-eared bat that pulses in bursts."},
    "umbrowl": {"name":"Umbrowl","type":"echo","col":"#4a3a8f","shade":"#251a52","size":1.1,"mods":{"hp":1.1,"atk":1.25,"spd":0.9,"rate":1},"w":1,"blurb":"A shadow owl with a heavy cry."},
    "zephling": {"name":"Zephling","type":"gale","col":"#7ff0dc","shade":"#2fae98","size":0.85,"mods":{"hp":0.9,"atk":0.95,"spd":1.2,"rate":1.05},"w":6,"blurb":"A breezy fledgling."},
    "kestrix": {"name":"Kestrix","type":"gale","col":"#2fc4a8","shade":"#145a4c","size":1,"mods":{"hp":1,"atk":1.2,"spd":1,"rate":1},"w":3,"blurb":"A razor-taloned hawk."},
    "stormwing": {"name":"Stormwing","type":"gale","col":"#3f8fd8","shade":"#1f4f8a","size":1.1,"mods":{"hp":1.1,"atk":1,"spd":1,"rate":1.25},"w":1,"blurb":"A sky ray that rides thunderheads."},
    "shardling": {"name":"Shardling","type":"crystal","col":"#ffa8e8","shade":"#c25aa8","size":0.85,"mods":{"hp":0.9,"atk":1,"spd":1.05,"rate":1.15},"w":6,"blurb":"A chip off a bigger gem."},
    "prismoth": {"name":"Prismoth","type":"crystal","col":"#c49bff","shade":"#7a52c2","size":1,"mods":{"hp":1,"atk":1.05,"spd":1.15,"rate":1},"w":3,"blurb":"A moth with light-bending wings."},
    "geodon": {"name":"Geodon","type":"crystal","col":"#8a6fb3","shade":"#3a2a5a","size":1.15,"mods":{"hp":1.35,"atk":1,"spd":0.85,"rate":0.95},"w":1,"blurb":"A tortoise carrying a geode."},
    "pebblet": {"name":"Pebblet","type":"warden","col":"#b8b0a0","shade":"#6a6458","size":0.85,"mods":{"hp":0.9,"atk":0.95,"spd":1.15,"rate":1.05},"w":6,"blurb":"A pebble that rolls everywhere."},
    "bastion": {"name":"Bastion","type":"warden","col":"#e3b04b","shade":"#9a7220","size":1,"mods":{"hp":1.3,"atk":0.95,"spd":0.95,"rate":1},"w":3,"blurb":"A living fortress wall."},
    "monolord": {"name":"Monolord","type":"warden","col":"#7a6a5a","shade":"#3a3028","size":1.15,"mods":{"hp":1.15,"atk":1.25,"spd":0.9,"rate":1},"w":1,"blurb":"A floating monolith with a crown."},
    "toxlet": {"name":"Toxlet","type":"venom","col":"#8fd14f","shade":"#4f7a2a","size":0.85,"mods":{"hp":0.9,"atk":1,"spd":1.1,"rate":1.05},"w":6,"blurb":"A bog newt with a dripping frill."},
    "fangmire": {"name":"Fangmire","type":"venom","col":"#6fae3a","shade":"#3a5a1f","size":1,"mods":{"hp":1.05,"atk":1.1,"spd":1,"rate":1},"w":3,"blurb":"A coiled marsh serpent whose fangs glow green."},
    "hydravine": {"name":"Hydravine","type":"venom","col":"#5a9a4a","shade":"#2a4a24","size":1.1,"mods":{"hp":1.3,"atk":1.15,"spd":0.9,"rate":0.95},"w":1,"blurb":"A three-headed vine hydra from the deep Sump."},
    "glimmet": {"name":"Glimmet","type":"lumen","col":"#fff3a8","shade":"#c9a84a","size":0.85,"mods":{"hp":0.9,"atk":1,"spd":1.15,"rate":1.1},"w":6,"blurb":"A lantern moth that drinks the dark."},
    "halowing": {"name":"Halowing","type":"lumen","col":"#ffe7c2","shade":"#b88a4a","size":1,"mods":{"hp":1.1,"atk":1.05,"spd":1.05,"rate":1},"w":3,"blurb":"A ringed seraph-bird that hums at dawn."},
    "solaryx": {"name":"Solaryx","type":"lumen","col":"#ffd27a","shade":"#c27a2a","size":1.15,"mods":{"hp":1.25,"atk":1.2,"spd":0.95,"rate":1},"w":1,"blurb":"A sun-maned beast from the Underheart's deepest hall."}
  },
  "HYBRIDS": [
    {"id":"blazewing","name":"Blazewing","types":["ember","gale"],"col":"#ff8a3d","shade":"#1f9585"},
    {"id":"bogbloom","name":"Bogbloom","types":["tide","fungal"],"col":"#4fb3a0","shade":"#9c2c4f"},
    {"id":"resonyx","name":"Resonyx","types":["crystal","echo"],"col":"#d88fff","shade":"#4a2fb3"},
    {"id":"forgeheart","name":"Forgeheart","types":["warden","ember"],"col":"#e39a3b","shade":"#7a2316"},
    {"id":"squallfin","name":"Squallfin","types":["gale","tide"],"col":"#3fd8e8","shade":"#1a3a9a"},
    {"id":"duskcap","name":"Duskcap","types":["fungal","echo"],"col":"#9a4ad8","shade":"#3a1a5a"},
    {"id":"gemguard","name":"Gemguard","types":["crystal","warden"],"col":"#f0a0c8","shade":"#9a7220"},
    {"id":"steamfin","name":"Steamfin","types":["ember","tide"],"col":"#ff9a7a","shade":"#3f7aa9"},
    {"id":"kilnspark","name":"Kilnspark","types":["ember","crystal"],"col":"#ff8fa8","shade":"#c2561d"},
    {"id":"mossguard","name":"Mossguard","types":["fungal","warden"],"col":"#9ac86a","shade":"#9a7220"},
    {"id":"deepsinger","name":"Deepsinger","types":["tide","echo"],"col":"#5a8aff","shade":"#3a2f5e"},
    {"id":"glasswing","name":"Glasswing","types":["gale","crystal"],"col":"#9ff0e0","shade":"#c88ab8"},
    {"id":"wailwind","name":"Wailwind","types":["gale","echo"],"col":"#7fd0c8","shade":"#5d43a3"},
    {"id":"blightcap","name":"Blightcap","types":["venom","fungal"],"col":"#9ac84a","shade":"#9c2c4f"},
    {"id":"mirefang","name":"Mirefang","types":["venom","tide"],"col":"#5aa07a","shade":"#2a4a6a"},
    {"id":"dawnsong","name":"Dawnsong","types":["lumen","echo"],"col":"#fff0c8","shade":"#7a5ab8"},
    {"id":"prismheart","name":"Prismheart","types":["lumen","crystal"],"col":"#ffe0f0","shade":"#c27aa8"},
    {"id":"eclipsar","name":"Eclipsar","types":["venom","lumen"],"col":"#c8d87a","shade":"#3a2a4a"}
  ],
  "LINE_DATA": {
    "cindlet": [["Cindlet",1,"ember1","flameRing"],["Cinderpup",10,"ember2","flameRing"],["Blazehound",20,"flamethrower","meteorShower"],["Infernox",30,"emberBurst","infernoNova",["pow",7]]],
    "pyrrox": [["Pyrrox",1,"ember2","flameRing"],["Pyrrovex",12,"emberFan","flameRing"],["Flarefang",22,"foxfire","meteorShower"],["Solarix",32,"solarLance","infernoNova",["tem",7]]],
    "magmaul": [["Magmaul",1,"magmaSlam","flameRing"],["Magmaw",15,"meteor","meteorShower"],["Calderon",28,"eruption","infernoNova",["vig",7]]],
    "puffcap": [["Puffcap",1,"spore1","sporeField"],["Toadstool",10,"spore2","sporeField"],["Sporelord",20,"sporeMortar","healBloom"],["Mycoking",30,"thornRing","rotCloud",["vig",7]]],
    "shroomite": [["Shroomite",1,"hornCharge","sporeField"],["Shroomhorn",12,"hornCharge","sporeField"],["Fungaroth",22,"hornQuake","healBloom"],["Blightbeetle",32,"hornQuake","rotCloud",["pow",7]]],
    "mycelisk": [["Mycelisk",1,"sporeFan","sporeField"],["Hyphaserp",15,"sporeStream","healBloom"],["Rhizowyrm",28,"seedHoming","rotCloud",["tem",7]]],